{
  "id": "m.make-videos",
  "domain": "teach-learn",
  "title": {
    "zh": "做技术视频",
    "en": "Making technical videos"
  },
  "question": {
    "zh": "做技术视频(YouTube、课程视频)时,形式、选题和制作流程怎么取舍?",
    "en": "When making technical videos (YouTube, course videos), how do you weigh format, topic and production?"
  },
  "claim": {
    "text": {
      "zh": "技术视频要在「技巧够酷」「每一步准确」「有趣简洁」之间做取舍,三者只能选两个;形式上可以用低成本的一镜到底提高频率,把重要内容切成小段精心录制;他还持续用自建工具(边录边剪的编辑器、AI 预演)降低制作成本。数据中等偏薄,多为他对自己做法的描述。",
      "en": "A technical video trades off between a cool technique, accuracy at every step, and being fun and concise; you only get two of the three. For format, cheap one-take recordings keep the pace up, while important material is cut into small pieces and recorded carefully. He keeps lowering production cost with his own tools (an editor that cuts while you record, AI previews). The data is medium to thin and mostly his description of his own practice."
    },
    "anchors": [
      {
        "url": "https://x.com/mattpocockuk/status/1614562523608489984",
        "date": "2023-01-15",
        "quote": "But you can only choose 2.",
        "quote_zh": "但你只能选两个。"
      }
    ],
    "evidence": "Supported"
  },
  "steps": [
    {
      "id": "m.make-videos#s1",
      "order": 1,
      "title": {
        "zh": "先决定这条视频要哪两样",
        "en": "First decide which two this video gets"
      },
      "how": {
        "zh": "技巧、准确、娱乐三者难以兼得。做教程就优先准确和步骤完整;做快讯或观点就优先有趣和简洁。先定取舍,再定长度和剪辑方式。",
        "en": "Technique, accuracy and entertainment are hard to get together. A tutorial puts accuracy and complete steps first; a news item or opinion puts fun and brevity first. Decide the trade-off before the length and the editing."
      },
      "anchors": [
        {
          "url": "https://x.com/mattpocockuk/status/1614562523608489984",
          "date": "2023-01-15"
        }
      ],
      "evidence": "Direct",
      "since": "2023"
    },
    {
      "id": "m.make-videos#s2",
      "order": 2,
      "title": {
        "zh": "选题:一条一个主题,讲新动态或新心智模型",
        "en": "Topics: one topic per video, news or a new mental model"
      },
      "how": {
        "zh": "一条视频只讲一个主题:他把原本的一条长视频按依赖图拆成多条短视频,发现更能留住观众、也更利于搜索。他还观察到「新闻式」视频和能给出新心智模型的讲解视频反响最好:报道 TS 社区的新动态,或者把一个常见主题换个角度讲透。",
        "en": "One video covers one topic: he split one long video along its dependency graph into several short ones and found they held viewers better and did better in search. He also saw that news-style videos and explanations that give a new mental model do best: reporting what is new in the TS community, or taking a common topic from a new angle and explaining it fully."
      },
      "anchors": [
        {
          "url": "https://x.com/mattpocockuk/status/1883066122628661615",
          "date": "2025-01-25",
          "quote": "Short, sharp videos on distinct topics works much better",
          "quote_zh": "短小、主题分明的视频效果好得多"
        },
        {
          "url": "https://x.com/mattpocockuk/status/1596819948759834625",
          "date": "2022-11-27",
          "quote": "y'all are CRYING OUT for videos with a more 'journalistic' style.",
          "quote_zh": "大家非常渴望更「新闻式」的视频。"
        },
        {
          "url": "https://x.com/mattpocockuk/status/1543531676680310784",
          "date": "2022-07-03"
        }
      ],
      "evidence": "Direct",
      "since": "2022"
    },
    {
      "id": "m.make-videos#s3",
      "order": 3,
      "title": {
        "zh": "两种节奏:低成本一镜到底,和分段精录",
        "en": "Two rhythms: a cheap single take, and careful pieces"
      },
      "how": {
        "zh": "日常内容可以一镜到底、不剪辑,十分钟做完,保持频率(他后来专门开了一个发原始内容的副频道);重要内容(如会议演讲)切成小段逐段录好再拼起来。",
        "en": "Everyday content can be one take with no editing, done in ten minutes, to keep up the frequency (he later started a second channel just for raw content); important material (such as a conference talk) is cut into short pieces, each recorded well and then joined."
      },
      "anchors": [
        {
          "url": "https://x.com/mattpocockuk/status/1646924821769379870",
          "date": "2023-04-14",
          "quote": "Decide to try an unedited, one-shot format where I talk about something cool",
          "quote_zh": "试试不剪辑、一镜到底的形式,聊点有意思的东西"
        },
        {
          "url": "https://x.com/mattpocockuk/status/1719679736471818651",
          "date": "2023-11-01",
          "quote": "I'll be recording it in tiny, beautiful sections",
          "quote_zh": "我会把它切成小而精致的片段来录"
        },
        {
          "url": "https://x.com/mattpocockuk/status/2025867715387240629",
          "date": "2026-02-23",
          "quote": "post more raw content at a higher frequency.",
          "quote_zh": "以更高频率发更原始的内容。"
        }
      ],
      "evidence": "Direct",
      "since": "2023"
    },
    {
      "id": "m.make-videos#s4",
      "order": 4,
      "title": {
        "zh": "缩略图当作产品的一部分来练",
        "en": "Practise thumbnails as part of the product"
      },
      "how": {
        "zh": "缩略图决定点击。他会在设计工具里模拟 YouTube 页面,把缩略图放在真实环境里比较。",
        "en": "Thumbnails decide clicks. He mocks up a YouTube page in a design tool and compares thumbnails in a realistic setting."
      },
      "anchors": [
        {
          "url": "https://x.com/mattpocockuk/status/1578340441207894016",
          "date": "2022-10-07",
          "quote": "practicing my thumbnail game by mocking up YouTube in figma",
          "quote_zh": "在 Figma 里模拟 YouTube 页面来练缩略图"
        }
      ],
      "evidence": "Direct",
      "since": "2022"
    },
    {
      "id": "m.make-videos#s5",
      "order": 5,
      "title": {
        "zh": "用工具降低制作成本:边录边剪、AI 预演",
        "en": "Use tools to cut production cost: edit while recording, AI previews"
      },
      "how": {
        "zh": "他自建了视频编辑器:录制时按说话自动切片并转写,可以边录边删;2026 年又让 AI 根据课程内容生成带配音的预演版(animatic),在正式拍摄前检查节奏和画面。",
        "en": "He built his own video editor that slices and transcribes by speech as you record, so you can delete as you go. In 2026 he also had AI generate a voiced preview (an animatic) from course content, to check pacing and visuals before the real shoot."
      },
      "anchors": [
        {
          "url": "https://x.com/mattpocockuk/status/1966957584235327500",
          "date": "2025-09-13",
          "quote": "Whenever speaking is detected, it shows a new clip appearing in my editor.",
          "quote_zh": "一检测到说话,编辑器里就出现一个新片段。"
        },
        {
          "url": "https://x.com/mattpocockuk/status/2105212971307667862",
          "date": "2026-09-30",
          "quote": "draft versions of videos I'm about to film.",
          "quote_zh": "即将拍摄的视频的草稿版。"
        }
      ],
      "evidence": "Direct",
      "since": "2025"
    }
  ],
  "pitfalls": [
    {
      "text": {
        "zh": "想一条视频同时做到又酷、又完整准确、又短又有趣。",
        "en": "Trying to make one video cool, complete and accurate, and short and fun all at once."
      },
      "anchors": [
        {
          "url": "https://x.com/mattpocockuk/status/1614562523608489984",
          "date": "2023-01-15"
        }
      ],
      "evidence": "Direct"
    },
    {
      "text": {
        "zh": "标题党缩略图:他承认偶尔用,但要内容配得上。",
        "en": "Clickbait thumbnails: he admits to using them now and then, but the content has to live up to them."
      },
      "anchors": [
        {
          "url": "https://x.com/mattpocockuk/status/1628065217505595393",
          "date": "2023-02-21",
          "quote": "Definitely my most clickbait thumbnail yet, but I think it's justified...",
          "quote_zh": "绝对是我最标题党的缩略图,但我觉得说得过去……"
        }
      ],
      "evidence": "Direct"
    }
  ],
  "evolution": [
    {
      "period": "2022",
      "change": "first",
      "stance": {
        "zh": "把 Twitter 上的 TS 技巧整理成 YouTube 播放列表;发现「新闻式」视频受欢迎;练缩略图。",
        "en": "He gathers his Twitter TS tips into YouTube playlists, finds news-style videos popular, and practises thumbnails."
      },
      "anchors": [
        {
          "url": "https://x.com/mattpocockuk/status/1539522713924030466",
          "date": "2022-06-22"
        },
        {
          "url": "https://x.com/mattpocockuk/status/1596819948759834625",
          "date": "2022-11-27"
        },
        {
          "url": "https://x.com/mattpocockuk/status/1578340441207894016",
          "date": "2022-10-07"
        }
      ]
    },
    {
      "period": "2023",
      "change": "refine",
      "stance": {
        "zh": "总结三选二;尝试一镜到底的低成本形式;演讲分段精录。",
        "en": "He sums up the pick-two rule, tries a cheap one-take format, and records talks in carefully made pieces."
      },
      "anchors": [
        {
          "url": "https://x.com/mattpocockuk/status/1614562523608489984",
          "date": "2023-01-15"
        },
        {
          "url": "https://x.com/mattpocockuk/status/1646924821769379870",
          "date": "2023-04-14"
        },
        {
          "url": "https://x.com/mattpocockuk/status/1719679736471818651",
          "date": "2023-11-01"
        }
      ]
    },
    {
      "period": "2025–2026",
      "change": "refine",
      "stance": {
        "zh": "自建边录边剪的编辑器;开副频道发原始内容;用 AI 生成视频预演。",
        "en": "He builds an editor that cuts while recording, starts a second channel for raw content, and uses AI to generate video previews."
      },
      "anchors": [
        {
          "url": "https://x.com/mattpocockuk/status/1966957584235327500",
          "date": "2025-09-13"
        },
        {
          "url": "https://x.com/mattpocockuk/status/2025867715387240629",
          "date": "2026-02-23"
        },
        {
          "url": "https://x.com/mattpocockuk/status/2105212971307667862",
          "date": "2026-09-30"
        }
      ],
      "current": true
    }
  ],
  "related": [
    "m.teach-explain",
    "m.course-design",
    "m.write-threads"
  ],
  "evidence": "Supported",
  "sources_count": {
    "keyword_hits": 87,
    "curated": 15
  },
  "date_first": "2022-06-22",
  "date_last": "2026-09-30",
  "status": "draft",
  "updated": "2026-10-28"
}
